{
  "slug": "living-as-a-muslim-in-a-secular-democracy",
  "stage_slug": "addressing-misconceptions",
  "order": 9,
  "title": "Living as a Muslim in a Secular Democracy",
  "summary": "Closing this collection with the practical, positive case for civic belonging — loyalty, voting, and participation — and a straightforward answer to \"can you really be loyal to both?\"",
  "estimated_minutes": 7,
  "need_to_know": false,
  "body": [
    {
      "type": "heading",
      "text": "The underlying question"
    },
    {
      "type": "text",
      "text": "Underneath many of the specific fears covered in this collection is one broader question: can a practising Muslim be genuinely, fully loyal to a secular, non-Muslim-majority country? This closing lesson answers that directly and positively."
    },
    {
      "type": "heading",
      "text": "Honouring agreements is itself an Islamic value"
    },
    {
      "type": "text",
      "text": "As covered in the Fiqh section, fulfilling contracts and agreements is a direct Quranic command, and citizenship (or simply residency) carries an implicit agreement to abide by the country's laws and civic norms. Loyalty to one's country of residence isn't in tension with Islamic teaching — it's an application of it."
    },
    {
      "type": "quote",
      "translation": "O you who have believed, fulfill [all] contracts.",
      "reference": "Quran 5:1 (Saheeh International, abridged)"
    },
    {
      "type": "heading",
      "text": "Voting and civic participation"
    },
    {
      "type": "text",
      "text": "Far from discouraging it, the large majority of contemporary scholars actively encourage voting and civic engagement for Muslims living as minorities, viewing it as a legitimate, effective way to protect community interests, promote justice, and contribute to the common good — values Islamic teaching holds in high regard generally. Sitting out of civic life is, if anything, the position that's harder to justify from mainstream fiqh, not the reverse."
    },
    {
      "type": "heading",
      "text": "A long, established history, not a new experiment"
    },
    {
      "type": "text",
      "text": "Muslims have lived as religious minorities under non-Muslim governance continuously for well over a thousand years, in numerous times and places — this isn't a novel 21st-century predicament without precedent or established scholarly guidance. The Fiqh section's lesson on living under secular law covers the specific classical and contemporary scholarship (fiqh al-aqalliyyat) developed precisely for this situation."
    },
    {
      "type": "heading",
      "text": "Dual belonging is normal, not contradictory"
    },
    {
      "type": "text",
      "text": "Being a committed Muslim and a genuinely loyal, engaged citizen of a secular democracy are not competing identities requiring you to pick one — countless Muslims across the West serve in public office, the military, healthcare, education, and every other sector of civic life, without treating their citizenship as a compromise of their faith. Many describe their religious values — honesty, service, justice, care for community — as directly motivating their civic engagement, not sitting in tension with it."
    },
    {
      "type": "heading",
      "text": "A note to close this collection"
    },
    {
      "type": "text",
      "text": "The nine lessons in this section haven't been about winning arguments — they've been about giving you an accurate, well-grounded understanding of your own faith on topics you're very likely to be asked about, so those conversations can happen from a place of calm knowledge rather than defensiveness or uncertainty. Family and friends who raise these questions are, in most cases, coming from care and worry, not hostility — meeting that with patience tends to go further than winning a debate."
    },
    {
      "type": "faq",
      "question": "What's a good way to summarise all of this if someone asks \"so are you still loyal to this country?\"",
      "answer": "Something direct and simple tends to land best: \"Yes — being honest, law-abiding, and civically engaged is part of my faith, not separate from it.\" You don't need an elaborate defence for a question that has a genuinely simple, true answer."
    },
    {
      "type": "faq",
      "question": "What if I still feel torn or unsure about some of these questions myself?",
      "answer": "That's completely normal, especially early on — these are real, substantial topics, and feeling like you need to sit with some of them longer, or ask a knowledgeable local scholar directly, is a sign of taking your faith seriously, not a problem. This collection is a starting point for understanding, not the final word on any of these topics."
    },
    {
      "type": "reflection",
      "question": "Looking back across this whole collection, which single lesson do you think you'll reach for most often in real conversations — and is there one you'd like to understand even more deeply?"
    }
  ],
  "further_reading": [
    { "label": "Living Under Secular Law", "reference": "See Fiqh in Daily Life" },
    { "label": "What Is Sharia Law, Really?", "reference": "See Understanding Islam section" }
  ]
}
