{
  "slug": "slavery-in-islamic-history",
  "stage_slug": "addressing-misconceptions",
  "order": 30,
  "title": "Slavery in Islamic History: An Honest Look",
  "summary": "A direct, non-defensive look at slavery's real history within Islamic civilisation — what Islamic teaching actually regulated and encouraged, what it didn't outright abolish, and where things stand today.",
  "estimated_minutes": 8,
  "need_to_know": false,
  "body": [
    {
      "type": "heading",
      "text": "A topic that requires honesty over defensiveness"
    },
    {
      "type": "text",
      "text": "Slavery existed within Islamic civilisation across many centuries, and pretending otherwise would be dishonest and, frankly, unconvincing to anyone who looks into it. This lesson takes it head-on, aiming for accuracy rather than either denial or the opposite extreme of treating it as a uniquely Islamic failing."
    },
    {
      "type": "heading",
      "text": "Historical context: a near-universal pre-modern institution"
    },
    {
      "type": "text",
      "text": "Slavery existed in essentially every major civilisation prior to the modern abolition movements of the 18th-19th centuries — ancient Greece and Rome, pre-colonial Africa, the Americas, East Asia, and the pre-Islamic Arabian society Islam emerged within. This context matters for accuracy, not as an excuse: Islamic civilisation did not invent slavery, and addressing it fairly means placing it in that broader global historical pattern."
    },
    {
      "type": "heading",
      "text": "What Islamic teaching actually regulated and encouraged"
    },
    {
      "type": "text",
      "text": "Compared to many contemporary legal systems, Islamic teaching introduced real, textually grounded protections and incentives: humane treatment was religiously mandated, enslaved people had specific legal rights (including, in classical fiqh, a path to purchase their own freedom through a formal contract, mukataba), and freeing a slave (itq) is repeatedly described as one of the most highly rewarded acts a Muslim can perform — including being prescribed as religious expiation for specific sins."
    },
    {
      "type": "quote",
      "translation": "It is not righteousness that you turn your faces to the east or the west, but righteousness is... freeing slaves...",
      "reference": "Quran 2:177 (Saheeh International, abridged)"
    },
    {
      "type": "text",
      "text": "This pattern — consistent, repeated religious encouragement toward manumission, built into acts of worship and atonement — is a real, documented feature of the sources, not a modern reinterpretation invented for this conversation."
    },
    {
      "type": "heading",
      "text": "Being honest about what it did not do"
    },
    {
      "type": "text",
      "text": "It would be inaccurate to claim classical Islamic law abolished slavery as an institution — it regulated, ameliorated, and consistently incentivised ending it person-by-person, but did not categorically prohibit the practice the way modern law does. This is an important, honest distinction: regulation and encouragement toward ending it are real and textually grounded, but they are not the same claim as outright abolition, and conflating the two isn't accurate."
    },
    {
      "type": "heading",
      "text": "Where things stand today"
    },
    {
      "type": "text",
      "text": "Slavery has been legally abolished in every Muslim-majority country, and mainstream contemporary Islamic scholarship treats it as entirely incompatible with modern moral and legal standards — a settled matter of consensus among essentially all mainstream scholars and institutions today, not a live debate."
    },
    {
      "type": "heading",
      "text": "ISIS's revival of slavery: extremism, forcefully condemned"
    },
    {
      "type": "text",
      "text": "ISIS's enslavement of Yazidi women and others is sometimes cited as evidence that slavery remains sanctioned in Islam. This was met with immediate, explicit, forceful condemnation from mainstream Islamic scholars and institutions worldwide, including detailed religious refutations of ISIS's specific claimed justification — treated by essentially the entire mainstream Islamic scholarly world as a grotesque, extremist distortion, not a legitimate revival of authentic practice."
    },
    {
      "type": "faq",
      "question": "Isn't it uncomfortable that Islamic teaching didn't just ban slavery outright from the start?",
      "answer": "It's a fair, honest discomfort worth sitting with rather than deflecting — the same discomfort applies to essentially every other ancient legal and religious tradition that regulated rather than immediately abolished the institution, since outright abolition as a global norm is a genuinely modern development, not something any 7th-century legal system anywhere achieved."
    },
    {
      "type": "faq",
      "question": "What's an honest way to respond if someone raises ISIS's actions as representative of Islamic teaching?",
      "answer": "Naming the forceful, near-universal condemnation from mainstream scholars directly, and noting that slavery is illegal and religiously rejected in every Muslim-majority country today, is a factual, honest response — not a deflection, since it's simply what actually happened and what the mainstream position actually is."
    },
    {
      "type": "reflection",
      "question": "Did approaching this topic with full honesty, rather than either denial or over-apology, feel like a more solid foundation for discussing it with others?"
    }
  ],
  "further_reading": [
    { "label": "Islamic History: A Brief Overview", "reference": "See Stage 4" },
    { "label": "\"Is Islam a Violent Religion?\"", "reference": "See Understanding Islam section" }
  ]
}
