{
  "slug": "telling-christian-family-youve-reverted",
  "stage_slug": "comparison-christianity",
  "order": 43,
  "title": "Telling Christian Family You've Reverted: What to Expect and How to Prepare",
  "summary": "Opening the final, practical section of this collection with honest guidance on the conversation many reverts dread most: telling Christian family.",
  "estimated_minutes": 7,
  "need_to_know": false,
  "body": [
    {
      "type": "heading",
      "text": "The conversation this whole collection has been preparing you for"
    },
    {
      "type": "text",
      "text": "Everything covered so far in this collection — the shared ground, the honest theological differences, the practical comparisons — has been building toward this: the actual conversation with Christian family about your reversion. This final section turns from content to the conversation itself."
    },
    {
      "type": "heading",
      "text": "Expect a real range of reactions"
    },
    {
      "type": "text",
      "text": "Family reactions to this news genuinely range widely — from calm acceptance, to confusion, to real grief, to anger, to persistent attempts to change your mind, sometimes over an extended period rather than resolving in one conversation. For many Christian parents especially, this can trigger real fear about your eternal salvation, given the theological weight discussed earlier in this collection — understanding that fear as coming from love, even when it's expressed poorly, can help you respond with more patience."
    },
    {
      "type": "heading",
      "text": "Choosing your moment and setting"
    },
    {
      "type": "text",
      "text": "A calm, private setting, when you have real time to talk rather than a rushed moment, generally goes better than an abrupt announcement in passing or during an already-tense family gathering. Some reverts choose to tell one family member first and let that person help share the news more broadly; others prefer a single family conversation. Neither approach is more \"correct\" — choose what fits your specific family dynamics."
    },
    {
      "type": "heading",
      "text": "Leading with what hasn't changed"
    },
    {
      "type": "text",
      "text": "Many reverts find it helps to lead with reassurance about what remains constant — you still love them, you're still the same person with the same relationships and responsibilities (a point made directly in Stage 1's Shahadah lesson), and this is a considered, sincere decision, not a rejection of them personally. Leading with theology or debate points, before that reassurance, tends to put family on the defensive faster."
    },
    {
      "type": "heading",
      "text": "It's fine not to have every answer ready"
    },
    {
      "type": "text",
      "text": "You don't need to have every theological question in this collection perfectly rehearsed before this conversation — it's completely acceptable to say \"I'm still learning about that, let me get back to you\" rather than feeling pressure to defend every point of Islamic theology on the spot. This is very likely to be an ongoing conversation over months or years, not a single event you need to get perfectly right immediately."
    },
    {
      "type": "faq",
      "question": "What if my family reacts with real anger or refuses to speak to me?",
      "answer": "This does happen, and it's genuinely painful — prioritising your own safety and wellbeing, giving family space and time rather than pushing for immediate resolution, and seeking support from your local Muslim community or a mental health professional experienced with faith transitions are all reasonable, healthy responses; a later lesson in this section covers the emotional side of this in more depth."
    },
    {
      "type": "faq",
      "question": "Should I wait until I feel completely confident in my beliefs before telling family?",
      "answer": "There's no requirement to wait for total confidence — many reverts tell family relatively early and continue learning and growing in their faith throughout the process; waiting indefinitely for perfect readiness can sometimes cause more anxiety than having the conversation while still growing."
    },
    {
      "type": "reflection",
      "question": "If you haven't yet told your family, what feels like the biggest obstacle to that conversation right now? If you already have, what would you tell a fellow revert who's about to?"
    }
  ],
  "further_reading": [
    { "label": "The Shahadah: The Declaration of Faith", "reference": "See Stage 1" },
    { "label": "Answering \"Don't You Still Believe in Jesus?\"", "reference": "See this collection, next lesson" }
  ]
}
